id,title,description,address,lat,lng,features,rating,url,external_id
298558,Landgoed Huize Glory,"Huize Glory is an intimate hotel located in spacious grounds among woodland and dunes, 8.1 mi from Alkmaar. It features free Wi-Fi, a sea-view terrace and restaurant serving international cuisine.

The rooms at Landgoed Huize Glory are benefit from light décor and include a daily buffet breakfast. Each room also includes a refrigerator, work desk and a TV. Some of the rooms come with tea and coffee making facilities.
All the rooms are on the first floor and we also have a Deluxe room on the 2nd floor.

The beach is just over a 15-minute walk away and Sluispolder Golf Club is 15 minutes by car from the property. Bergen aan Zee is just over a 10-minute walk away.

A bicycle rental service and packed lunches are available for guests who wish to explore the surrounding area which is rich in picturesque hiking and biking routes. Private on-site parking is also available.","Elzenlaan 2, 1865 BM Bergen aan Zee, Netherlands",52.66525049,4.64211255,{},7.9,https://www.booking.com/hotel/nl/landgoed-huize-glory.html,15486
10794,City Hotel Hengelo,"City Hotel Hengelo is centrally located in Hengelo and only a 2-minute walk from the train station. There is free WiFi throughout the hotel.

Every floor of City Hotel Hengelo has its own theme. These are Arts, Hengelo, Traveling and Theater. The rooms have large bathrooms with a spacious shower.

The bar are open dailly and offer breakfast, a cup of coffee and a drink in the evening.

The hotel is located only a few minutes from shops and restaurants, offering dinner options. There is also a theater next door. The FBK Stadium is 0.6 mi away. Military Boekelo is just over a 15-minute drive away. Public parking is available, across the hotel.","B.P. Hofstedestraat 50, 7551 DG Hengelo, Netherlands",52.2634446,6.7956347,{},8.4,https://www.booking.com/hotel/nl/city-hotel-hengelo.html,14727
50834,Hotel Mademoiselle,"Hotel Mademoiselle is located between Gare du Nord and Gare de l'Est train stations. The 24-hour reception hotel is decorated in a modern style. Guests can enjoy a hammam and a sauna, free of charge if shared or at an extra cost if privatized upon prior request.

It offers air-conditioned accommodations with satellite TV and a telephone. The private bathroom includes free toiletries, bathrobes and a hairdryer.

A buffet breakfast is served every morning. A snack bar is also available on site and you can sample a glass of wine at Hotel mademoiselle. There are 3 living rooms where you can read the newspapers or use free Wi-Fi access.

Hotel Mademoiselle is just a short walk from the Grands Boulevards. It is a 10-minute Metro ride from the Montmartre district and the Sacré-Coeur Basilica.","7 Rue des Petits Hôtels, 10th arr., 75010 Paris, France",48.87729644,2.35436663,{},8.1,https://www.booking.com/hotel/fr/relaislafayette.html,16156
10121,Mercure Hotel Amsterdam West,"This property is a 5-minutes walk from a small lake with a beach in natural park De Oeverlanden. Mercure Hotel Amsterdam West is a 15 minute drive from Amsterdam city center, and a 10 minute drive from Amsterdam Zuid. Schiphol International Airport is a 10 minute drive from the hotel. The bus stop to reach the city center is within walking distance from the property.

When on the A4 highway, take exit 1-Sloten and from there Mercure Hotel Amsterdam West is a 4 minute drive. Parking is available on site (surcharge).

Rooms are practically-furnished and include comfortable beds, a TV, mini-bar and desk. All bathrooms feature a shower.

The on-site restaurant serves international dishes for lunch and diner. In the summertime, guests can enjoy the terrace with garden views.","Oude Haagseweg 20, Slotervaart, 1066 BW Amsterdam, Netherlands",52.33750487,4.81692955,{},7.5,https://www.booking.com/hotel/nl/mercure-airport.html,15099
4253679,Hotel Pontsteiger,"You're eligible for a Genius discount at Hotel Pontsteiger! To save at this property, all you have to do is 
sign in
.


 
Ideally set in the Westerpark district of Amsterdam, Hotel Pontsteiger is set 1.9 mi from Royal Palace Amsterdam, 2.2 mi from Anne Frank House and 2.5 mi from Flower Market. With a bar, the 4-star hotel has air-conditioned rooms with free WiFi, each with a private bathroom. Private parking is available on site.

At the hotel, every room is fitted with a wardrobe. At Hotel Pontsteiger the rooms come with a flat-screen TV with cable channels.

Speaking English and Dutch, staff will be happy to provide guests with practical information on the area at the reception.

Rembrandt House is 2.6 mi from Hotel Pontsteiger, while Basilica of St. Nicholas is 2.6 mi from the property. The nearest airport is Schiphol Airport, 11 mi from the hotel.","Pontsteiger 343, Westerpark, 1014 ZP Amsterdam, Netherlands",52.392447,4.885673,{},7.7,https://www.booking.com/hotel/nl/pontsteiger-amsterdam12.html,14641
3632144,Grand Hotel Huis ter Duin,"Facing the beachfront, Grand Hotel Huis ter Duin offers 5-star accommodations in Noordwijk aan Zee and features a fitness center, garden and shared lounge. Providing a restaurant, the property also has a terrace, as well as an indoor pool and a sauna. The property provides room service, a 24-hour front desk and currency exchange for guests.

The hotel will provide guests with air-conditioned rooms offering a desk, a safety deposit box, a flat-screen TV and a private bathroom with a shower. At Grand Hotel Huis ter Duin each room includes bed linen and towels.

Guests at the accommodation can enjoy a buffet breakfast.

Grand Hotel Huis ter Duin offers 5-star accommodations with a spa center. The area is popular for hiking and cycling, and bike rental is available at this 5-star hotel.

Guests can use the business center or relax in the bar.

Noordwijk aan Zee Beach is a 2-minute walk from the hotel, while Keukenhof is 7.5 miles away. The nearest airport is Schiphol Airport, 18 miles from Grand Hotel Huis ter Duin.","Koningin Astrid Boulevard 5, 2200 AB Noordwijk aan Zee, Netherlands",52.241414,4.427886,{},8.5,https://www.booking.com/hotel/nl/grand-huis-ter-duin.html,15344
10436,Carlton Oasis Hotel,"Carlton Oasis Hotel is located in Spijkenisse,the largest city on the island of Voorne-Putten in South Holland. Get free access to the Carlton Sport sport center. All rooms have coffee and tea facilities, a TV and free unlimited secured Wi-Fi access.

Carlton Oasis Hotel has a restaurant for snacks, a complete dinner or a cold beer.

The fitness area, the indoor swimming pool, the sauna and the Turkish steam bath are all freely accessible to guests.

The hotel is a 30-minute drive away from Rotterdam and Zeeland.  With 22 mi of coastline, beautiful nature and characteristic villages this part of the country is beautiful for walks.

Hotel Carlton Oasis offers free parking facilities.","Curieweg 1, 3208 KJ Spijkenisse, Netherlands",51.85257363,4.30545509,{},7.3,https://www.booking.com/hotel/nl/carltonoasis.html,14537
10554,WestCord Art Hotel Amsterdam 3 stars,"The 3-star WestCord Art Hotel is located on the edge of the historic center of Amsterdam. A 15-minute walk through the Westerpark will get you to the heart of the city. Guests benefit from free Wi-Fi throughout the hotel. Parking is available on-site.

The modern rooms have air conditioning, lcd TV and a Nespresso coffee machine. All rooms have artworks above the bed and a bathroom with a bath or rain shower.

Westcord Art Hotel Amsterdam includes a unique art collection of the famous Dutch painter Herman Brood. There is a terrace with a bar which overlooks the lush grounds.The ART Brasserie offers à la carte breakfast, lunch and dinner. Bikes can be rented at the hotel.

The hotel is located 0.9 mi from the Westerpark, where restaurants and cultural activities can be found. Business park Westpoort is nearby. The Hempoint bus stop is located directly opposite the hotel and offer direct services to the city center in 5 minutes. The city center is at 1.2 mi distance and Schiphol Airport is a 20-minute drive away.","Spaarndammerdijk 302, Westerpark, 1013 ZX Amsterdam, Netherlands",52.39280779,4.8687847,{},8.3,https://www.booking.com/hotel/nl/westcord-art-hotel-amsterdam-3-stars.html,15716
8488462,Le Grand Pavillon Chantilly,"Located in Chantilly, 3.4 miles from Chantilly-Gouvieux Train Station, Le Grand Pavillon Chantilly provides accommodations with a fitness center, free private parking, a garden and a shared lounge. With free WiFi, this 4-star hotel offers a kids' club and room service. There's a spa and wellness center with a terrace, indoor pool and sauna, as well as a hammam.

The hotel will provide guests with air-conditioned rooms offering a closet, a coffee machine, a minibar, a safety deposit box, a flat-screen TV and a private bathroom with a shower. Le Grand Pavillon Chantilly has certain units that include a balcony, and all rooms include an electric tea pot. At the accommodation every room has bed linen and towels.

Breakfast is available daily, and includes buffet, à la carte and continental options. At Le Grand Pavillon Chantilly you'll find a restaurant serving French and European cuisine. Vegetarian, dairy-free and gluten-free options can also be requested.

The area is popular for cycling, and bike rental is available at this 4-star hotel.

With staff speaking English and French, guidance is available at the reception.

Domaine de Chaalis is 10 miles from the hotel, while Parc Asterix Amusement Park is 12 miles away. The nearest airport is Paris - Charles De Gaulle, 15 miles from Le Grand Pavillon Chantilly, and the property offers a paid airport shuttle service.","4 Route de Senlis, Vineuil-Saint-Firmin, 60500 Chantilly, France",49.196755,2.515273,{},7.9,https://www.booking.com/hotel/fr/le-grand-pavillon-chantilly-vineuil-saint-firmin.html,16096
10657,Hotel Alkmaar,"Hotel Alkmaar is located on the outskirts of Alkmaar near the A9 motorway and features a 24-hour reception. There is ample free parking in front of the property.

Hotel Alkmaar offers rooms with 50 inch TV and a work desk. All rooms are accessible by elevator. Guests can enjoy a daily buffet breakfast.

You can also dine in the a Japanese sushi and grill restaurant Kokusai. The hotel offers 5 flexible meeting rooms equipped with a beamer, flip chart and coffee machines. Bike rental is also available.

The center of Alkmaar is easily accessible and is 1.2 mi away. Here you will find the famous Waagplein  the the Dutch Cheese Museum. Hotel Alkmaar is 35-minute drive from Amsterdam. Egmond aan Zee and the beach are 6.8 mi away.","Arcadialaan 6, 1813 KN Alkmaar, Netherlands",52.61598311,4.74281341,{},7.9,https://www.booking.com/hotel/nl/gtalkmaar.html,15336
77320,Hotel Duo,"Hotel Duo offers accommodations in Prague for business and leisure travelers, just 656 feet from the Střižkov Metro Station. The metro takes you to the Main Train Station within 17 minutes. The Old Town Square with the Astronomical Clock can be reached within 30 minutes by metro.

All spacious air-conditioned rooms and suites include a flat-screen TV with satellite channels, a safety deposit box, an electric kettle, a mini-bar, and a bathroom fitted with a bath or a shower.

Guests at Hotel Duo can enjoy delicious food in the rustic-style restaurant and in the beer garden during summer. Meeting facilities and 24-hour reception are at disposal.

From the Střížkov Metro Station located in front of the hotel you can reach the city center in about 10 minutes by metro line C. The O2 Arena can be reached within a 30-minute public transport ride.","Teplicka 492, Prague, 19000, Czech Republic",50.12675853,14.48592961,{},8.5,https://www.booking.com/hotel/cz/duo.html,16196
2912243,Moxy Amsterdam Houthavens,"Located in the Westpoort district of Amsterdam, Moxy  Amsterdam Houthavens is 1.4 mi from Westerpark. It is located within the Houthavens, an area well-known for design, food and startups. The city center can be reached within 20 minutes by public transport. The wellness area includes a sauna, a fitness center and an indoor pool.

The units in the hotel are fitted with a Smart TV. With a private bathroom, rooms at Moxy Amsterdam Houthavens also provide guests with free WiFi. The lobby has a living room vibe and features a 24/7 Moxy Bar.

The area is popular for cycling, and bike hire is available at this hotel.

The 9 Streets with Anne Frank House are just 2.7 mi From Moxy Amsterdam Houthavens. Dam square is 3.1 mi away. The nearest airport is Schiphol Airport, 8.1 mi from the hotel.","Danzigerkade 175, Westpoort, 1013 AP Amsterdam, Netherlands",52.401708,4.874811,{},8,https://www.booking.com/hotel/nl/moxy-by-marriott-amsterdam-houthavens.html,15919
1334542,KABOOM Maastricht,"This unique hotel offers modern rooms, a restaurant, a courtyarden garden and direct entrance to the coffeehouse and restaurant next door. Free high-speed WiFi throughout the whole building is also offered. Kaboom has been awarded for Best Hotel Concept 2015 by a Dutch magazine.

Kaboom is located right in front of the Central Station of Maastricht, in the trendy district of Wyck, known for its authentic boutiques and specialty shops. The rest of Maastricht is within reach, just 10 minutes walking distance towards the historical center with the Vrijthof and the old Market

Each room is equipped with 2 Comfy Auping beds with anti-allergic bedding, a rain shower in the bathroom and a large flat-screen TV. You can bring your own tablet and connect to our free WiFi.

The reception is open 24/7 so there is always someone at your disposal for assistance with checking–in and –out or to help you with directions. The courtyard garden is a good place to have a chat with other hotel guests, to relax or to do some work.

At KABOOM Maastricht, guests can enjoy a delicious extensive breakfast. The adjacent restaurant offers Asian Fusion cuisine, including sushi and half lobsters

The LBG Live Like a Local card: Upon arrival, all guests receive a local discount card for discounts at various entrepreneurs in Maastricht.

Vrijthof is 0.7 mi from KABOOM Maastricht, while St Servaas Bridge is 1969 feet away. The MECC convention center is at 1.6 mi. The nearest airport is Maastricht Airport, 5 mi from KABOOM Maastricht. Paid public parking is possible at P+R Station Maastricht.","Stationsplein 1, Wijck, 6221 BT Maastricht, Netherlands",50.84953129,5.70473771,{},7.9,https://www.booking.com/hotel/nl/kaboom.html,14895
171016,Townhouse Design Hotel & Spa,"Townhouse is located in historic Maastricht and has been awarded the Planet Care eco-label. This unique design hotel features free WiFi, a restaurant and a lounge combining modern elements with vintage style. The Markt is 2953 feet away.

The interiors of the air-conditioned rooms at Townhouse Hotel Maastricht include light colors and unique furniture. They also boast high-tech features such as remote controlled curtains and flat-screen cable TV. The hotel offers wellness facilities and a 'microgym' with optional extras including pampering packages and the possibility to have a fishbowl in the room.

Maastricht Central Railway Station is 656 feet from the hotel. The famous Vrijthof is a 10-minute walk away. Guests can make use of the bicycle rental service when exploring the local area.

Upon arrival at reception, a mug of hot home-made soup is offered. Additionally, all guests receive the LBG Live Like a Local card for discounts at various entrepreneurs in Maastricht. The lounge features comfortable seating and a fireplace. The breakfast area has long wooden tables where guests eat together each morning.

The apartments are equipped with a kitchenette that includes microwave oven, fridge, coffee/tea facilities and sink.","Sint Maartenslaan 5, Wijck, 6221 AV Maastricht, Netherlands",50.85151866,5.70327759,{},7.8,https://www.booking.com/hotel/nl/townhouse-maastricht.html,14910
10872,Steigenberger Airport Hotel Amsterdam,"You're eligible for a Genius discount at Steigenberger Airport Hotel Amsterdam! To save at this property, all you have to do is 
sign in
.


 
This hotel has a Sports & Media bar and a free Schiphol Airport shuttle service which reaches the airport within 10 minutes.

Steigenberger Airport Hotel Amsterdam has rooms decorated with natural materials and colors. The rooms also include extra-long beds, satellite TV and tea/coffee making facilities.

The Amsterdamse Bos next to the hotel is great for biking and walking.

The Lifestyle Club & Active Spa has saunas, a steam bath, a heated indoor swimming pool and a relaxation area with an outdoor sunny terrace. Guests can also work out in the fitness room or book a relaxing massage treatment. Bike rental is available on site.

The Patio Restaurant offers an extensive worldly breakfast buffet and fine lunch and dinner menus for groups with garden views. The Trattoria serves a traditional Italian menu and wines from all over the world. The live cooking stations in both restaurants enhance the dining experience. The casual Sports & Media Bar (lunch and diner) features a variety of international dishes alongside beverages and televised sports events from all corners of the globe. The Coffee & Wine lounge serves a range of drinks including coffee and cocktails.","Stationsplein 951 ZW, 1117 CE Schiphol, Netherlands",52.3086623,4.81044531,{},8.3,https://www.booking.com/hotel/nl/steigenberger-airport-hotel-amsterdam.html,15918
11713,Mabi City Centre Hotel,"Hotel Mabi City Center Hotel is located in the historical part of the city, in a building where the Cinema Maastricht offered its services. The hotel offers a bar, cinema, free Wi-Fi and 24-hour reception.

The design of the rooms draws inspirations from Art Deco style. Each room is equipped with a flat-screen TV, luxury bedding and modern bathrooms. The hotel is located on a courtyard in the center of Maastricht.

A continental breakfast buffet is available every morning in the breakfast area, Little Cannes and meals are served throughout the day at hotel's restaurant. In the afternoon, guests can enjoy a free glass of wine at Bar Twisted.

The Onze Lieve Vrouwe Square, known for its cafés and terraces, is just a 10-minute walk away. The Vrijthof is a 5-minute walk from the hotel.

Upon arrival, all guests receive a local discount card for discounts at various entrepreneurs in Maastricht.","Kleine Gracht 24, Boschstraatkwartier, 6211 CB Maastricht, Netherlands",50.85251604,5.69204718,{},8.1,https://www.booking.com/hotel/nl/hotel-mabi-city-centre.html,14896
19141,Grand Hotel Alkmaar,"This 4-star hotel is located in a historical building, in the heart of Alkmaar, where it provides tasteful design rooms with free Wi-Fi internet.

The Grand Hotel Alkmaar offers luxurious accommodations in its authentic residence, which has maintained many of its original features. Start your day with a wholesome breakfast in the trendy Brasserie Bar X-Press.

Enjoy the stylish atmosphere of this hotel and benefit from the excellent service of its 24-hour reception.","Gedempte Nieuwesloot 36, 1811 KT Alkmaar, Netherlands",52.63241825,4.74693999,{},7.8,https://www.booking.com/hotel/nl/grand-alkmaar.html,15341
5512886,The Collector,"You're eligible for a Genius discount at The Collector! To save at this property, all you have to do is 
sign in
.


 
Featuring a bar, The Collector Hotel is located in The Hague in the Zuid-Holland region, 2.1 mi from New Babylon and 2.2 mi from Madurodam. The property is set 3.7 mi from Paleis Huis Ten Bosch, 1.5 mi from MegaStores Den Haag and 1.7 mi from Escher Museum. The property provides city views, a terrace, a 24-hour front desk, and free WiFi is available throughout the property.

All units are equipped with air conditioning, a flat-screen TV with cable channels, a kettle, a shower, a hairdryer and a desk. At the hotel, every room comes with a private bathroom with free toiletries.

Binnenhof is 1.7 mi from the accommodations, while Louwman Museum is 3.1 mi away. The nearest airport is Rotterdam The Hague Airport, 12 mi from The Collector Hotel.","52 Haagsche Bluf, The Hague City Center, 2511 CP The Hague, Netherlands",52.077136,4.309453,{},9.2,https://www.booking.com/hotel/nl/the-collector.html,15155
11761,Hotel Villa Ruimzicht,"Villa Ruimzicht is a monumental building just outside Doetinchem city-center, located in an arboretum, a special city estate with monumental trees.

After an enormous reconstruction this former boarding school is transformed into a luxury 4 star hotel with 42 spacious rooms in a thematic setting, dependent on the reason of your visit.

All our rooms are non-smoking!","Ruimzichtlaan 150, 7001 KG Doetinchem, Netherlands",51.97257352,6.28808767,{},8,https://www.booking.com/hotel/nl/villa-ruimzicht.html,15819
3020610,Hotel Plattenhof,"You're eligible for a Genius discount at Hotel Plattenhof! To save at this property, all you have to do is 
sign in
.


 
Located in Termeno, 25 miles from The Gardens of Trauttmansdorff Castle, Hotel Plattenhof provides accommodations with a seasonal outdoor swimming pool, free private parking, a garden and a terrace. Each room at the 4-star hotel has mountain views, and guests can enjoy access to a sauna and a hot tub. Every room has a balcony with pool views and free WiFi.

At the hotel each room comes with air conditioning, a seating area, a flat-screen TV with satellite channels, a safety deposit box and a private bathroom with a bidet, free toiletries and a hairdryer. At Hotel Plattenhof the rooms are equipped with bed linen and towels.

The daily breakfast offers buffet, continental or Italian options. At the accommodation you'll find a restaurant serving Italian and European cuisine. Vegetarian, dairy-free and gluten-free options can also be requested.

Hotel Plattenhof has a playground. The area is popular for hiking and cycling, and bike rental is available at this 4-star hotel.

Touriseum Museum is 25 miles from the hotel, while Parco Maia is 26 miles away. The nearest airport is Bolzano Airport, 14 miles from Hotel Plattenhof.","Söll 33, 39040 Termeno, Italy",46.35898326,11.24390602,{},9.3,https://www.booking.com/hotel/it/weinresidenz-plattenhof.html,17982
10265,Landgoed Groot Warnsborn,"Welcome to Landgoed Groot Warnsborn, located in a unique location on the edge of the Veluwe. Enjoy the peaceful and wooded surroundings, close to the center of Arnhem, where you k
benefit from free parking and excellent service.

Our estate also offers the exclusive fine dining restaurant La Belle Source, where you can enjoy a culinary 6- to 8-course dinner. For a slightly more informal experience, return to our brasserie de Bron, where we offer a 3-course choice menu. Every dish in the kitchen of Landgoed Groot Warnsborn is prepared with homegrown products whenever possible.
Both restaurants also have their own private terrace where you can enjoy lunch or dinner outside.

Our luxury 4-star hotel has 40 beautiful unique rooms, divided over two buildings. The manor house has 25 unique rooms, while the coach house offers another 15 rooms. Keep in mind that each room has its own character.
The rooms in the manor house are actually divided into 3 different styles. First, we have rooms in the mansion that are decorated in the New York style. The main feature of these is that you should consider OPEN BATHROOMS. Next, we have 8 renovated rooms, which we like to describe as ""classic in a new look. These rooms feature old rose tones and bathrooms with green marble. Finally, in the ridge of the mansion we have 2 Warnsborn suites. It is important to note that these suites also have OPEN BATHROOMS, as shown in the photos. In addition, it is important to note that you cannot access these suites by elevator.
The rooms in the coach house on the first floor all have private terraces and are Scandinavian in style. While the rooms on the second floor, on the other hand, is decorated more bohemian with colors such as ochery yellow and red.
Each room comes with free WIFI and a private bathroom. But beware because there are rooms with an open bathroom.

Landgoed Groot Warnsborn is the ideal base for exploring beautiful hiking and cycling routes. The estate consists of no less than 750 acres of monumental land. Moreover, its proximity to the National Park De Hoge Veluwe is definitely worth exploring. There are also other attractions such as the Open Air Museum, Burgers Zoo, and the Kroller-Muller Museum, all of which can be reached within 5 minutes by car from our estate.

We welcome you to Landgoed Groot Warnsborn for an unforgettable stay full of nature, culinary delights and relaxation.","Bakenbergseweg 277, 6816 VP Arnhem, Netherlands",52.01025425,5.86533934,{},8.5,https://www.booking.com/hotel/nl/grootwarnsborn.html,15485
