id,title,description,address,lat,lng,features,rating,url,external_id
10434,Carlton President,"Carlton President, on the edge of Utrecht, offers a free shuttle service during the week to De Wetering, Papendorp, Oudenrijn and Maarssen Railway Station. This 4-star hotel also offers free use of the leisure center which includes a sauna, spa bath and steam bath.

The Carlton President provides tastefully decorated rooms equipped with modern and luxurious facilities.

A healthy breakfast bowl or buffet with ingredients that are sourced locally is served daily.
Guest can enjoy lunch or dinner at the restaurant and bar One24 opened in the summer of 2018. The Restaurant serves seasonal, international dishes and snacks inspired by the Mediterranean and Middle-Eastern Cuisine. A refreshing cocktail, fine wine or a variety of special beers can be enjoyed at the bar.

The A2 offers easy access to the Jaarbeurs Convention Center and Schiphol Airport. There is a bus stop 656 feet away which offers access to the center in 15 to 20 minutes.","Floraweg 25, West, 3542 DX Utrecht, Netherlands",52.1206673,5.0383734,{},8.3,https://www.booking.com/hotel/nl/carltonpresident.html,14684
402292,Grand Hotel Ter Duin,"You're eligible for a Genius discount at Grand Hotel Ter Duin! To save at this property, all you have to do is 
sign in
.


 
Grand Hotel Ter Duin is located opposite the West Schouwen forest and the Zeepeduinen. It has a spa with a solarium, bar, and a restaurant, which opens onto a terrace overlooking the large garden. The hotel is located within a 17-minute walk of the beach.

The hotel has 137 rooms and apartments. The spacious rooms at Grand Hotel Ter Duin come with a modern décor and free wired internet. Each has a flat-screen TV, a seating area, an extra long bed and a private, spacious bathroom with a walk-in shower.

Guests can enjoy the spacious wellness center free of charge. It has an indoor pool, two saunas and a steam-bath. Guests can also make use of the fitness center.

The hotel features an international lobby bar and a restaurant where guests can enjoy a fresh daily menu or an a la carte dinner. During the summer months, the hotel prepares dishes from the Big Green Egg in the hotel's courtyard. A rich breakfast buffet is served daily. Packed lunches and room service are available upon request.

The hotel has two fully equipped boardrooms and four meeting halls, which makes it possible for both large and small groups or companies to choose Grand Hotel Ter Duin as a meeting venue. In cooperation with various partners in the area, it is possible to offer diverse team building activities to complete the stay.

The hotel is less than 50 minutes' drive from Rotterdam, Breda, Antwerp and Ghent.","Hogeweg 55, 4328 PB Burgh Haamstede, Netherlands",51.68365522,3.72315288,{},7.6,https://www.booking.com/hotel/nl/grand-ter-duin.html,15345
7066792,"voco The Hague, an IHG Hotel","Voco The Hague, an IHG Hotel has a fitness centre, garden, a terrace and bar in The Hague. This 4-star hotel offers room service, a 24-hour front desk and free WiFi. The property is 2.5 km from Madurodam, and within 600 metres of the city centre.

The rooms are fitted with a flat-screen TV with satellite channels, minibar, a coffee machine, a shower, free toiletries and a desk. Rooms come with a safety deposit box and certain rooms are equipped with city views. All units have a private bathroom, a hairdryer and bed linen.

A buffet, à la carte or American breakfast is available each morning at the property. At the hotel you will find a restaurant serving Dutch cuisine. Vegetarian, vegan and dairy-free options can also be requested.

The area is popular for cycling, and bike hire is available at this 4-star hotel.

Paleis Huis Ten Bosch is 4.1 km from voco The Hague, an IHG Hotel, while Westfield Mall of the Netherlands is 7 km from the property. The nearest airport is Rotterdam The Hague Airport, 19 km from the accommodation.","Kneuterdijk 8, The Hague City Centre, 2514 EN The Hague, Netherlands",52.080708,4.308614,{},8.8,https://www.booking.com/hotel/nl/voco-the-hague.en-gb.html,15549
10744,Courtyard by Marriott Amsterdam Airport,"This 4-star superior Courtyard by Marriott Amsterdam Airport is located in the green surroundings of the Haarlemmermeer Woods and offers a fitness suite with saunas and a business lounge. You can reach Schiphol Airport in a 10-minute drive.

The hotel contains 260 renewed bedrooms with air conditioning and bathrooms with separate bath and shower. Free Wi-Fi is included. The bedrooms also feature access to internet TV, including Netflix, YouTube and Pandora.

Guests can enjoy different menus at the brasserie with a terrace or have a drink at the bar. There is also a 24-hour food market on site.The latest renovation of the accommodations was in April 2017.

Tourist attractions like Amsterdam, Haarlem, the Keukenhof and Zandvoort beach are within easy reach from Courtyard by Marriott Amsterdam Airport. A total of 20 bowling alleys and an array of restaurants and bars are located next to the hotel. A casino is also located within walking distance.

The hotel also offers 10 meeting spaces, including an auditorium room for up to 330 guests.

There is ample parking and the hotel is easily reached from the motorway.","Bosweg 15, 2131 LX Hoofddorp, Netherlands",52.32105182,4.66578841,{},8,https://www.booking.com/hotel/nl/courtyardmarriott.html,15304
6089839,The Fallon Hotel Alkmaar,"You're eligible for a Genius discount at The Fallon Hotel Alkmaar! To save at this property, all you have to do is 
sign in
.


 
Set in Alkmaar, 39 km from A'DAM Lookout, The Fallon Hotel Alkmaar offers accommodation with a fitness centre, private parking, a garden and a terrace. With free WiFi, this 4-star hotel has a restaurant and a bar. The property is non-smoking and is located 39 km from Amsterdam Central Station.

All guest rooms come with air conditioning, a flat-screen TV with satellite channels, a coffee machine, a shower, free toiletries and a wardrobe. All units feature a private bathroom, a hairdryer and bed linen.

A buffet, continental or vegan breakfast can be enjoyed at the property.

The area is popular for cycling, and bike hire is available at this 4-star hotel.

Speaking German, English and Dutch, staff will be happy to provide guests with practical information on the area at the 24-hour front desk.

Anne Frank House is 41 km from the hotel, while Leidseplein is 41 km from the property. The nearest airport is Schiphol Airport, 33 km from The Fallon Hotel Alkmaar.","Prins Bernhardlaan 16, 1815 JG Alkmaar, Netherlands",52.625856,4.729816,{},7.8,https://www.booking.com/hotel/nl/the-fallon-alkmaar.en-gb.html,14733
10531,Hotel Zuiderduin,"Located just 350 metres from the beach, Hotel Zuiderduin’s spa includes an indoor pool, 3 saunas and squash facilities. Its rooms have box-spring beds, satellite TV and a balcony.

Each room is decorated with warm colours, modern furnishings and a work desk. They come with a private bathroom with free toiletries.

Guests can choose from various activities such as bowling, squash or a work-out in the fitness room. There is an extensive playground available for children as well.

Hotel Zuiderduin also houses a restaurant which serves international cuisine for breakfast, lunch and dinner. The brasserie offers drinks and light snacks through the day.

From Zuiderduin Hotel, it’s only 300 metres to Egmond aan Zee’s shopping street. The Sluispolder golf courses are 10 km away. Bicycle rental is also available at the hotel.","Zeeweg 52, 1931 VL Egmond aan Zee, Netherlands",52.61636988,4.62512746,{},8,https://www.booking.com/hotel/nl/hotelzuiderduin.en-gb.html,15446
10373,Resort Bad Boekelo,"You're eligible for a Genius discount at Resort Bad Boekelo! To save at this property, all you have to do is 
sign in
.


 
Resort Bad Boekelo is set in 25 hectares of woodland and offers a range of leisure activities on-site. This quietly situated hotel offers accommodations with free Wi-Fi and guests can use the sauna for free. It is just over a 5-minute drive from the A35 motorway.

All of the rooms, suites and apartments at Resort Bad Boekelo have a balcony, TV and free Wi-Fi. The private bathroom is fitted with a shower or bath.

Comfortable chairs, a fireplace and a drink and snack menu combine to make the lounge a cosy place to relax. The Moods restaurant serves International cuisine with a selection regional specialities and local ingredients.

The wellness facilities include a sauna with a Turkish steam bath, indoor swimming pool and plunge pool. Guests can also enjoy a range of beauty treatments for an extra charge. The hotel features a bowling alley and 2 all-weather tennis courts.

The centre of Enschede and Haaksbergen are both within 8 km from the hotel. Hengelo and the A1 highway are 15 minutes by car.","Oude Deldenerweg 203, 7548 PM Boekelo, Netherlands",52.19431567,6.78241879,{},7.6,https://www.booking.com/hotel/nl/gtboekelo.en-gb.html,15018
171045,WestCord Hotel Eindhoven,"You're eligible for a Genius discount at WestCord Hotel Eindhoven! To save at this property, all you have to do is 
sign in
.


 
WestCord Hotel Eindhoven is located in the city centre, within 5 minutes on foot from Eindhoven Railway Station. The hotel offers spacious rooms and suites.

Part of the hotel is located in the monumental Philips light tower, built in 1909. The rooms are individually designed. A wide variety of shades and patterns combined with hand-picked furniture create a different experience in every room. The loft rooms are located in the light tower and offer a genuine city experience by the 4 meter high ceilings.

Guests can enjoy the live- cooking breakfast buffet with a glass of bubbles, lunch or intimate dinner for two in the restaurant. The hotel bar is known for its wide variety of whiskeys and beers.

Free Wi-Fi is available to guests in the entire hotel, as well as a parking garage (charges applicable).

Philips Stadium is a 7-minute walk. High Tech Campus is 5 km away and Eindhoven Airport is 7.5 km. Efteling is a 30-minute drive and Den Bosch is 20 minutes away by car.","Lichttoren 22, Eindhoven City Centre, 5611 BJ Eindhoven, Netherlands",51.44085714,5.47408074,{},7.8,https://www.booking.com/hotel/nl/inntel-hotels-art-eindhoven.en-gb.html,14553
538195,Mainport Design Hotel,"You're eligible for a Genius discount at Mainport Design Hotel! To save at this property, all you have to do is 
sign in
.


 
This luxurious 5-star Mainport Design Hotel is located on the Maas River banks in the city centre of Rotterdam, and offers free Wi-Fi and free access to Spa Heaven and wellnessclub H20, which has an indoor swimming pool. Rotterdam Central Station is 5 minutes by metro. The hotel has a waterfront terrace and a private jetty which is accessible for taxi and party boats,

These design rooms at Mainport Design Hotel is individually decorated in a luxury setting. All rooms are equipped with an XXL 4-layer signature bed, a whirlpool and walk-in shower. Some have a private spa bath and Finnish sauna as well. They feature air-conditioning, a flat-screen TV, a mirror TV, a work desk and a minibar. Each room is individually air-conditioned and feature e.g. an Illys espresso machine, ironing equipment, bathrobes and slippers.

Every morning a live-cooking breakfast buffet is served in Restaurant Down Under. In the evenings you can enjoy a à-la-carte menu at Mainport Hotel. On The Rocks cocktail bar offers you a wide variety of drinks.

Spa Haven offers a wide range of wellness facilities including a Panorama sauna with a view over the Rotterdam Skyline, a Turkish steam room, hamam, showers with scrubs, massages and body treatments. Guests can go work out in the Life Fitness Gym situated next to the spa, or go swimming in the Wellnessclub H2O.

There is a 24-hour front desk at Mainport Hotel. Ahoy event hall is a 9-minutes’ drive. The Rotterdam Harbour is 6 minutes by car. The A13, A15, A16 and A20 highways are all within a 10-minute drive. Metro and tram stop Leuvehaven is in front of the hotel. Valet parking is offered at a surcharge.","Leuvehaven 77, Centrum, 3011 EA Rotterdam, Netherlands",51.91298113,4.48239988,{},8.3,https://www.booking.com/hotel/nl/mainport-hotel.en-gb.html,15147
10891,Landgoed Duin & Kruidberg,"You're eligible for a Genius discount at Landgoed Duin & Kruidberg! To save at this property, all you have to do is 
sign in
.


 
Situated in the peaceful Zuid Kennemerland National Park, this historic country house includes period English-style rooms. Kruidberg is a 4-star hotel which features the exclusive Spa & Wellness centre 't Princenbosch.

Landgoed Duin & Kruidberg offers rooms with classic décor in the main house and rooms with modern décor in a separate wing. Each of the rooms includes a flat-screen TV, work desk and tea and coffee making facilities.

Free private parking is available on site. The beach and the Spaarnwoude Recreation Area are both less than a 15-minute drive from Landgoed Duin & Kruidberg. Amsterdam is 30 minutes’ drive away.","Duin en Kruidbergerweg 60, 2071 LE Santpoort-Noord, Netherlands",52.4343246,4.62578595,{},8.4,https://www.booking.com/hotel/nl/duinkruidberg.en-gb.html,15092
10532,Carlton Square Hotel,"The Carlton Square is a 4-star hotel, located in the heart of Haarlem. It combines international allure with a luxurious ambiance and hospitality. Free  Wi-Fi access is available throughout the property. The beach of Zandvoort is reachable within 15 minutes by car.

Guests can stay in one of the luxurious rooms with modern facilities. All rooms have air conditioning and tea and coffee making facilities and a minibar. For some room types, use of the minibar is included in the price.

The informal atmosphere and the changing menu with daily fresh and local products make restaurant ""Bar & Kitchen Zocher"" a popular location. Guests can enjoy a drink at the on-site bar. An extensive breakfast is served daily.

The hotel is located in the historical centre of Haarlem at 1.8 km from the train station. Schiphol Airport and the city centre of Amsterdam can be reached within a 20-minute drive.

Haarlem is awarded the ‘Best Shopping city of The Netherlands’. There are numerous boutiques, antique shops and famous designer labels. The old centre characterizes itself by the small estates and many monumental curiosities.","Baan 7, 2012 DB Haarlem, Netherlands",52.37430885,4.63154197,{},8.2,https://www.booking.com/hotel/nl/carltonsquare.en-gb.html,14535
864563,Landgoed Ehzerwold,"You're eligible for a Genius discount at Landgoed Ehzerwold! To save at this property, all you have to do is 
sign in
.


 
Offering a restaurant, a garden and a terrace, Landgoed Ehzerwold is located in Almen on a historical estate in Gelderse Achterhoek. Free WiFi access is available here.

Each rooms here will provide you with a TV and a seating area. The private bathroom comes with a bath or shower, a hairdryer and free toiletries. Extras include a desk. The hotel rooms are situated in the garden in two seperate buildings.

A breakfast buffet is served on a daily basis in the conservatory, while you can have lunch in the bar with a lounge. Guests can also opt for the dinner buffet.

If you feel like visiting other places, check out Zutphen (10.6 km), Deventer (21.2 km) or Bronkhorst (18.6 km). Schiphol Airport is 135 km away. The property offers free parking.","Ehzerallee 14, 7218 BS Almen, Netherlands",52.16263329,6.32777346,{},7.8,https://www.booking.com/hotel/nl/landgoed-ehzerwold-almen.en-gb.html,15405
19658,Post-Plaza Hotel & Grand Café,"You're eligible for a Genius discount at Post-Plaza Hotel & Grand Café! To save at this property, all you have to do is 
sign in
.


 
Post-Plaza Hotel & Grand Café is situated in the city centre of Leeuwarden. After the renovation and restoration of the old post office, the Post-Plaza Hotel & Grand Café is transformed into a place where guests can stay in a historical atmosphere. The hotel rooms are located within the old post office in the old Gratama Bank. Both locations are connected through a glass bridge.

This hotel has 82 rooms which feature a flat screen TV, laptop safe, coffee and tea making facilities, a bathroom and free WiFi. All rooms are non-smoking.

The Grand Café is located within the former post office. In the Grand Café guests can enjoy breakfast, lunch and diner. The Grand Café is opened from 07:00 to 01:00. Authentic meals and beverages are served. The Barista burns his own coffee beans.

Post-Plaza Hotel & Grand Café is located in a quiet street, a 2 minute walk from the city centre. The station is 1.2 km away from the hotel. The nearest bus stop is Blokhuisplein 300 metres away.","Tweebaksmarkt 25-27, 8911 KW Leeuwarden, Netherlands",53.20143536,5.80048554,{},8.7,https://www.booking.com/hotel/nl/grand-post-plaza.en-gb.html,14532
10509,Bilderberg Europa Hotel Scheveningen,"You're eligible for a Genius discount at Bilderberg Europa Hotel Scheveningen! To save at this property, all you have to do is 
sign in
.


 
This Bilderberg Europa Hotel is situated in Scheveningen - The Hague. It has free WiFi and is at 110 metres from the beach. Most of the rooms have a balcony.

The property offers different room types and are equipped with a flatscreen-TV. The bathroom has a bath or a walk-in rain shower.

Food and drinks are served at SALT Coastal Bistro & Bar, where guests can taste, eat and share with the seashore in the background. All starters and mains can be ordered as 'tasting' (half portion), normal dish or 'sharing' (1,5 portion). At the bar or on the terrace guests can enjoy a cup of coffee, a gin tonic or a cocktail.

The AFAS Circus theater and Holland Casino Scheveningen are at a 5 minute walk from the hotel. The city centre can be reached by tram within 15 minutes, the tram stop itself is at 150 metres.","Zwolsestraat 2, 2587 VJ Scheveningen, Netherlands",52.11438484,4.28561144,{},6.7,https://www.booking.com/hotel/nl/bbeuropa.en-gb.html,15257
338622,"Crowne Plaza Amsterdam - South, an IHG Hotel","Crowne Plaza South is located in South-Amsterdam, just a 5-minute walk from station Amsterdam Zuid which connects guests to the city center within 10 minutes. It offers modern design accommodation, fitness facilities and an on-site bar with 2 large sunny outdoor terraces.

Each Crowne Plaza room is equipped with a spacious seating area with a flat-screen TV with satellite and pay TV channels. The large bathroom comes with free toiletries, bathrobes and slippers. A Pillow menu is offered for guests to choose their favourite pillow out of 5 options.

Guest can enjoy Asian cuisine in the new signature restaurant Happyhappyjoyjoy. It has a huge variety of street food dishes, dim sum, rendang and curries.

The hotel also offers bike rental.

The RAI Convention Centre is less than 2 km away. Schiphol Airport is within 15 minutes by car and 10 minutes by train. Amsterdam’s historic centre is 3.3 km away.","George Gershwinlaan 101, Zuideramstel, 1082 MT Amsterdam, Netherlands",52.33580453,4.87454742,{},8.5,https://www.booking.com/hotel/nl/crowne-plaza-city-zuid.en-gb.html,15305
10338,Hotel De Bilderberg,"You're eligible for a Genius discount at Hotel De Bilderberg! To save at this property, all you have to do is 
sign in
.


 
Hotel De Bilderberg is located in the green surroundings of Oosterbeek, near the city of Arnhem. Explore the Veluwe area on foot or by bike.

You do not have to get bored at this hotel. Warm up in the sauna and the Turkish steam bath or enjoy the indoor swimming pool for a relaxing swim during the day.

The hotel rooms are comfortable and well-kept. Each room has a private bathroom and offers stunning views on the surrounding forests.

Get refreshed with a cup of coffee and a fresh croissant at breakfast. The hotel bar welcomes you for a drink.

Start your evening with a delicious dinner at restaurant Trattoria Artusi. Enjoy the mixture of Italian cuisine with Mediterranean influences while recovering from your day.

The direct area around Hotel De Bilderberg is very suitable for hiking and cycling. Arnhem and Nijmegen offer you culture, shopping areas and lovely restaurants and cafés.","Utrechtseweg 261, 6862 AK Oosterbeek, Netherlands",51.98993299,5.81775963,{},7.6,https://www.booking.com/hotel/nl/bilderberg.en-gb.html,14533
10237,Bilderberg Hotel 't Speulderbos,"You're eligible for a Genius discount at Bilderberg Hotel 't Speulderbos! To save at this property, all you have to do is 
sign in
.


 
The charming Bilderberg Hotel t Speulderbos is located in a lovely green area, surrounded by moors and fairy-like sand-drifts. Enjoy a comfortable stay and breakfast. Free WiFi access is also available.

The hotel rooms are luxurious and have a private bathroom. The extensive breakfast buffet is available for a surcharge and contains delicious breads and delicacies, as well as coffee, tea and juices.

Take some time to relax on the squash tennis court or jump into the heated indoor swimming pool. The sauna and solarium will relax any tension left in your muscles. If you have time, work out in the fitness room.

Restaurant 't Speulderbos serves French orientated à la carte dishes. The Grand Café welcomes you during the day for coffee with cake, lunch or a drink. In the evening guests can enjoy a la carte dishes.

You can park your car for free at Bilderberg Hotel t Speulderbos. This means you can easily go for a long walk in the surrounding nature right from the hotel. Families with children can visit The Dolfinarium and the Apenheul.","Speulderbosweg 54, 3886 AP Garderen, Netherlands",52.23906839,5.69977999,{},7.9,https://www.booking.com/hotel/nl/speulderbos.en-gb.html,14911
4845440,Corsendonk Turnova,"Set 20 km from Bobbejaanland, Corsendonk Turnova offers 4-star accommodation in Turnhout and features a terrace, a bar and a spa and wellness centre. Featuring a shared lounge, the 4-star hotel has air-conditioned rooms with free WiFi, each with a private bathroom. The hotel offers a sauna and room service.

At the hotel, every room includes a desk. The units in Corsendonk Turnova are equipped with a flat-screen TV and free toiletries.

Guests at the accommodation can enjoy a buffet breakfast.

Speaking English, French and Dutch, staff will be happy to provide guests with practical information on the area at the reception.

Landhuis Wolfslaar is 34 km from Corsendonk Turnova, while De Efteling is 40 km away. The nearest airport is Antwerp International, 41 km from the hotel, and the property offers a paid airport shuttle service.","Kursaalpoort 10, 2300 Turnhout, Belgium",51.32298845,4.94995259,{},8.7,https://www.booking.com/hotel/be/corsendonk-turnova.en-gb.html,15879
10089,Carlton Ambassador,"Carlton Ambassador offers luxurious rooms in the historic centre of The Hague, only 270 meters from the city centre at Noordeinde. The hotel provides guests with a lounge with a fireplace and large paintings.

Each of the air-conditioned rooms at Lifestyle Hotel Carlton Ambbasador features a flat-screen TV, work desk and a minibar. They also come with tea and coffee making facilities and bathroom with a robe and slippers.

The elegant Sophia Restaurant serves international bistro-style cuisine with signature dishes. Guests also benefits from access to a large garden terrace.

The Mauritskade tram stop is 350 metres away and offers a direct service to Scheveningen and the beach in less than 15 minutes. The Peace Palace is a 5-minute walk away.","Sophialaan 2, The Hague City Centre, 2514 JP The Hague, Netherlands",52.08565328,4.30287614,{},8.3,https://www.booking.com/hotel/nl/ambassador.en-gb.html,15209
10508,Carlton Beach,"This hotel offers rooms with a balcony only 50 metres from the beach in Scheveningen. Carlton Beach includes wellness facilities and and two restaurants.

Carlton Beach features rooms with modern bathrooms with a sliding glass door design. Each of the rooms has a refrigerator with various drinks and has a Nespresso coffee machine.

Holland Casino Scheveningen is a 10-minute walk from the hotel and the famous pier is only 5 minutes’ away. The centre of Den Haag is a 15-minute tram journey away from the Zwarte Pad tram stop which is 50 metres from Carlton.

The wellness facilities at Carlton Beach include an indoor swimming pool with a solarium, steam bath and fitness centre. There are also indoor and outdoor saunas plus guests can enjoy a range of relaxing massages treatments.

The Beach Brasserie serves light lunch bites and bar snacks in a casual setting with an open-fire of unique design. International cuisine and organic dishes are served in the Smugglers Grill & Bar.","Gevers Deynootweg 201, 2586 HZ Scheveningen, Netherlands",52.11718731,4.28759795,{},7.6,https://www.booking.com/hotel/nl/carltonbeach.en-gb.html,15270
10197,Hotel Restaurant De Zwaan,"Hotel Restaurant De Zwaan is situated in the centre of Raalte, in the Eastern part of The Netherlands. A heated swimming pool is available free of charge for all guests. Free Wi-Fi and free parking are available.

All of the rooms include a TV, desk and tea and coffee facilities.

Since april 2021 the restaurant is renovated. The cuisine of De Zwaan offers a wide range of regional and international dishes of high class.

Raalte Railway Station is 600 metres away. The Sallandse Heuvelrug National Park is 20 minutes' drive from the hotel. Guests can make use of car hire and packed lunch service when exploring the local area.","Kerkstraat 2, 8102 EA Raalte, Netherlands",52.387379,6.27521172,{},8.2,https://www.booking.com/hotel/nl/zwaan.en-gb.html,15383
